{
  "schema_version": "1.0",
  "machine_id": "M-007",
  "line_id": "LINE-B",
  "window_start": "2026-09-06T14:22:10.000Z",
  "window_end": "2026-09-06T14:23:10.000Z",
  "scored_at": "2026-09-06T14:23:12.480Z",
  "sample_count": 11,
  "is_scored": false,
  "skip_reason": "INSUFFICIENT_SAMPLES",
  "machine_state": "STARTING",
  "anomaly_score": null,
  "raw_score": null,
  "score_threshold": null,
  "is_anomaly": null,
  "consecutive_windows": 0,
  "top_contributors": [],
  "features": {},
  "model": {
    "name": "isolation_forest",
    "version": "1.3.0",
    "trained_at": "2026-09-01T08:00:00.000Z",
    "artifact_sha256": "9f2c1b7d4e6a8093c5f21e0da4b7c68931f5a2e0cd47b91836f2a0d5e7c41b9a"
  },
  "processing_delay_ms": 2480
}
